{
  "name": "Starting Area",
  "description": "The initial area of the game.",
  "tiles": [
    "############",
    "#........#",
    "#........#",
    "#.>.......#",
    "#........#",
    "#........#",
    "############"
  ],
  "tileTypes": {
    "#": "wall",
    ".": "floor",
    ">": "trigger"
  },
  "triggers": [
    {
      "symbol": ">",
      "targetMap": "town_square",
      "targetLocation": {
        "x": 5,
        "y": 2
      }
    }
  ],
  "playerStart": {
    "x": 2,
    "y": 2
  }
}
